sighting_id,datetime,location_id,shape_id,duration_seconds,comments
1,11/19/2003 22:25,157,19,600,It was a scarey sight.
2,1/15/2007 20:00,75,9,3,1 bright green light that floated through the sky
3,12/10/1968 00:30,75,16,300,I had a close incounter with a UFO/(saucer/disc).  Craft hoovered about ten feet over my head backed off lowered to eye level then r
4,12/10/2013 18:00,157,9,1800,BRIGHT LIGHTS IN SKY.
5,3/31/2014 01:00,157,20,3,Coming home late last night into my apartment complex and my cousin and i saw a cigar shaped light flying fown wards and there was brig
6,7/4/2010 22:58,157,11,60,the flying apparatus had 30 to 40 lights n it and it was flying very slow heading north towards Lafayette Louisiana.
7,7/9/2002 23:45,75,11,120,ufo visits small town usa
8,10/15/2003 20:30,54,16,15,Dark colored semi-disked shaped craft flew over Aberdeen Wa.
9,10/29/2000 17:25,54,4,15,Descending burning green object seen over the ocean from Aberdeen WA
10,10/29/2001 22:00,54,4,120,well this the first time to this site but after seeing the reports of the same sighting i need to report this.  at about 10pm i was doi
11,10/4/1998 04:42,54,4,10,Descending fiery object exploded and lit up whole sky momentarily like transformer explosion at high altitude
12,11/15/1956 18:30,104,6,120,Traveled south to north at a slow speed(90deg. of arc in two min). Size of a half dollar coin at arms length had a neon orange glow.
13,12/31/2009 23:00,104,19,240,Orange balls shooting into the air and forming a check mark formation.
14,2/2/2014 20:00,54,18,300,Four red crosses/X&#39s flying east to west @ unknown altitude and speed.
15,3/10/2002 03:00,165,11,1200,i worked nights for rite aid distribution center as a yard jockey moving trailers around the yard  to be loaded for the following day.
16,3/29/2000 03:00,59,13,330,Approx 3:00am 0n 3/29/00 the following opbervations were observed by myself while observing the Pleadies star cluster in northern sky.
17,3/30/2004 15:30,100,11,300,triangular craft with large rounded tailfin
18,4/11/2008 00:15,165,14,30,Silent fast moving very dim or possibly lit from reflected ground light was either 6 or single objects or one object with 6 discs
19,4/22/2014 20:30,165,16,1800,Staring out my window across the Susquehanna River I see a humongous object with 4 lights.  I looked through my binoculars.
20,6/15/1981 22:00,54,7,3600,Cylindrical craft crashes near Aberdeen WA
21,6/15/1996 13:30,165,16,300,6 spaceshuttle technology schemed saucer shaped vehicles seen over AberdeenMd in summer of &#3996.
22,6/25/2002 23:30,54,6,15,STAR LIKE OBJECT MOVING QUICKLY FROM SW TO NE
23,8/18/1972 01:30,165,11,180,There were three lights on the object .There was no sound from the craft.It was treetop high in its flight.
24,9/30/1999 21:00,54,11,300,UFO seen - Giant seven lights slow low very loud low pitch roar traveled over town.
25,10/21/2008 20:30,127,13,180,Lights over AbileneTX
26,10/23/2008 20:30,127,19,3,My husband and I saw reddish orangish goldish lights in a line...going back and forth from right to left repeatly then disappear thi
27,10/27/2008 23:00,127,9,120,I saw a bright white light(not blinking) not any type of aircraft I know of...hence previous experience working on flight lines..
28,10/28/2008 20:00,127,9,180,I saw two huge lights in the southeastern sky at an angle like a pair of head lights but angled ( \ )with on light dimishing first slo
29,10/29/2008 19:45,127,9,900,Lights over Abilene
30,10/30/2008 23:05,127,9,180,Lights over Abilene TX
31,10/7/2010 22:35,127,9,300,2 red lights appear and disappear in the southeast skys over Abilene.
32,1/20/2006 21:30,127,9,2,4 Round Orange Glowing Objects
33,12/15/2012 21:40,127,9,900,High altitude light beams out of clouds in vertical pattern.
34,12/23/2004 16:00,127,1,10,The shiny hovering object sat there then it was suddenly gone.
35,1/27/2006 00:00,127,9,120,Strange lights in Abilene
36,1/31/2009 19:30,127,17,2,Was lights in the sky over Abilene
37,1/6/2008 22:00,127,9,10,Two lights moving west to east
38,2/14/2010 00:00,127,13,1800,My friend took pictures with night vision camera lights and craft matched stephensville photos
39,2/15/2009 24:00,127,14,180,It  was a very large space ship /craft of some kind hidden behind the smokey clouds as other  images passed slowly past it.
40,2/7/2002 19:40,127,9,1185,I was on my way home when I saw a very large light to large to have been an airplane from that height.  It passed behind big buildings
41,3/23/2012 22:00,127,11,8,Triangle sighting over Abilene Texas
42,3/31/2010 20:30,127,9,120,Bright Orange Lights in South East Sky around Abilene TX
43,4/27/2007 24:00,127,17,360,Brilliant magnesium diamond seen over Dyess Air Force Base/ Abilene Texas
44,4/7/2009 22:30,127,11,1800,Pictures were taken on cell phone.
45,5/17/2005 22:30,127,9,20,two points of light traversing the west texas sky  one seemingly in pursuit of the other
46,6/1/1931 13:00,152,16,1800,This is a what my mother related to me regarding an experience my grandparents had.  They did not tell anyone for 20 or more years beca
47,6/24/2009 21:05,127,5,1080,This happens to me all my life.
48,6/4/2005 02:00,127,9,2,Slow flashing light
49,7/15/1995 00:00,127,22,7200,3 people in Abilene TX observe star-like object performing normally physically impossible maneuvers in night sky.
50,7/6/2007 02:20,127,4,2,Largest &quot;Falling Star&quot; I&#39ve ever seen
51,8/17/2012 21:30,127,1,45,Formations of blue-white silent lights travelling at high speed over Abilene Texas.
52,8/18/2012 23:00,127,17,300,Initially 2 orange lights traveling quickly in N/NW direction followed by 4 blue objects also traveling in synchrony in a diamond confi
53,8/21/2009 03:23,127,11,60,Just a fairly quick fly by from some craft Ive never seen before.
54,9/1/1991 01:00,127,11,600,Swaying round light at rooftop height between 2 houses and right above--a huge triangular black object--no sound. 500 Lights On Obj
55,9/25/2003 00:00,152,13,240,Glider shaped with round greenish grey orbs making the formation changes formation
56,9/8/2002 18:15,127,16,6,I was taking a walk with a friend of mine when we looked up and saw a strange object. It was silver coloured and shaped somewhat like a
57,10/15/1997 18:40,161,9,600,Bristol Herald Courier run on Thursday (10-16-97) the following day &quot;Unusual lights in sky over Mountain Empire generate speculation&quot;.
58,10/22/2003 21:00,161,4,1800,Fireball reported by numerous persons in rural VA
59,11/1/2004 19:00,161,17,420,Bright light object spotted near exit 7 off Highway 81 in Bristol VA.  Next day I have a slight sunburn and my eyes are really red.
60,11/2/2008 02:15,31,4,300,I saw above the tree lines (not that far above) what looked to be like a shooting star/meteorite race across the sky. However it was lo
61,12/23/2005 17:48,161,14,1800,at firstlooked like a big bright starafter zooming in with my camer...looked like a mucial noteor a lopsides v
62,1/27/2005 19:00,31,9,300,object emitting a brilliant solid white light beam in a reverse triangle pattern
63,4/8/2008 21:05,161,17,60,Plane follows unexplained light
64,5/3/2007 21:30,31,11,120,A triangular shaped craft was seen hovering and moving very slowly over a neighborhood in Abingdon MD.
65,5/3/2007 21:30,31,11,120,Triangle craft seen &quot;hovering&quot; and moving very slowly.  There was one row of 3-4 lights lit up on one side of the craft.
66,6/23/2008 22:08,161,5,3600,2 LARGE rectangle 1 tubed craft seen over Abingdon VA
67,7/15/1991 23:00,124,15,240,i couldnt believe we were seeing this thing right above us.it was very spooky&#33
68,9/15/2003 21:00,161,6,1800,a large perfectly round light much larger and brighter than any star
69,9/19/2009 19:50,31,7,180,Extremely bright and radiating light outward.  ((NUFORC Note:  Missile launch.  PD))
70,9/2/2012 11:50,161,17,120,Thermal hit in the clouds after a storm
71,12/13/2012 00:00,130,11,90,Triangular shaped object glided through the sky in Abington Pa..
72,3/28/2004 20:00,130,8,120,I saw a silent diamond shaped craft with 5 lights on bottom traveling slow.  The outline was fuzzy.........
73,8/24/2013 17:00,130,6,1200,Something small circular and white very slowly moved from the north down the sky toward the flight paths to Philadelphia Airport.
74,2/10/2001 21:00,101,11,180,The widely seen BLACK TRIANGLE UFO
75,7/10/2004 20:14,101,19,2,Distant objects in formation visible in sunset photos
76,8/19/2004 15:05,101,11,60,Triangle &#39floating&#39 in the sky and observed between tall pine trees
77,10/15/2011 20:30,155,11,10,White triangle shape no lites or sound moving NNE in night sky.
78,11/13/2002 05:10,94,14,60,I was driving to work north highway 95 at 5:10 am before i reached actual site I atarted to see alot of lights looking like a huge sort
79,9/25/1998 20:00,15,10,3,An orange colored teardrop shaped object trailed by white sparks   appeared in the Eastern sky at about 130 degrees from the horizon.
80,10/25/2011 06:50,142,9,15,ball of light flew over vehicle at treetop level and vanished
81,8/24/1989 23:45,142,17,300,While traveling on the same road for three consecutive nights at about the same time each night all power on my vehicle suddenly stop
82,6/20/1977 20:30,84,11,1200,The object was triangular totally silent and observed for 20 min and moved slowly with red &amp; green lights and 1 white light.
83,9/8/2002 03:20,84,9,120,3 bright UFO over ulster county-Aliens at the Art Farm
84,1/13/2010 01:00,173,9,7200,A bright light hovering in the southwestern sky.  ((NUFORC Note:  Possible sighting of Sirius.  PD))
85,12/31/2011 18:30,186,22,180,Five orange orbs seen 6:30 pm 110 miles north of Traverse City MI
86,4/4/2001 21:30,137,8,8,Low Level Diamond shaped Object Reported
87,6/15/2006 24:00,137,14,300,I did NOT see a UFO ship. I saw what I feel was a UFO set of persons. My horse was a foal at the time and I was leading him (like walki
88,7/26/2002 23:30,186,9,60,It varied speed and wobbled as it flew.
89,10/1/1984 21:00,132,11,180,Silent very large one white headlight red lights around edges
90,11/26/2012 18:14,1,19,10,Route 2 West in Acton MASS Blue Lights doing amazingly impossible meanuvers.
91,1/15/1994 23:00,177,17,1800,it was like they knew i was watching them.
92,12/5/2005 19:40,177,4,60,Driving north on 14 Freeway 5 miles south of Escondido Drive bright clear skies as I was driving north on the side of the mountain I
93,4/24/2008 16:45,177,17,15,Bad weather and overcast skies make a great place to test  they&#39re new toys
94,4/25/2013 20:45,132,11,240,Black triangular silent craft with 3 white blinking lights on corners and one red one in center.
95,6/30/2012 22:00,185,6,900,Reddish Orange circle seen on Interstate 74.  Acton IN
96,7/26/2013 00:53,177,3,600,5 consecutive flashes of light.
97,8/15/1997 00:00,177,1,25,Oblong orange light in sky traveling at slow speed.  White beam of light came down from orange light then went back up into orange li
98,9/11/1999 22:16,177,4,3,While driving westbound on I14 from Acton I saw green ball of light move across the sky from my upper left to my lower right view throu
99,7/15/2010 21:00,181,9,1,light passing across road
100,11/11/2007 21:50,10,22,180,2 Objects with Extreme Flashing Lights Moving Diagonally Witnessed By Two
101,1/14/2011 03:30,10,5,60,viewed for one minute in acworth ga above treeline from bedroom window.
102,12/1/2005 05:00,10,22,180,egg-shaped light blue object fast speed and sphere-like camoflauged object moving slow.
103,12/13/2013 00:15,10,4,180,Three minutes fireball.
104,1/25/2008 03:00,10,4,4,Fiery light dog acting mad
105,2/22/2012 19:44,10,6,240,Saw a bright light disappear then reappear closer then slowly fade to dark.
106,6/15/1999 24:00,10,9,7200,Use of Spot Light
107,6/22/2012 02:45,10,11,60,A large aircraft (Triangle) about the size of a house or larger with no lights or sound and not moving above our tree line at house.
108,7/15/1995 05:30,10,6,30,Circular object  crimson in color maybe 10-20 ft. in dia. hovering maybe 20&#39 above ground appeared to be non-solid/holgram
109,7/16/1999 20:30,10,11,600,Me and my brother were taking the garbage out to the pile one night. We were standing in the yard just talking when we saw what looked
110,9/16/2005 07:45,10,5,120,Large rectangular shape almost colliding with jumbo jet over Acworth GA. on September 16th 2005
111,10/18/2004 17:45,23,11,180,Traingular Craft hovered over the tree line in the Ada OK Area
112,10/31/1967 20:30,23,6,12,Extreemly fast moving multi colored circle of light.
113,11/15/1999 21:15,178,9,1200,Very bright light over horizon which moved about 45 degrees over 20 minutes.  Similar to bright flickering star.
114,1/23/2007 01:15,166,10,2520,Teardropped shaped objects floating in the sky heading southwest out of ADA minnesota
115,1/5/2001 17:20,23,4,360,While driving home in the evening I saw four objects I can&#39t easily explain away moving fast in the western sky and then were gone.
116,2/22/2014 04:00,23,14,7200,UFO on pond dam.
117,4/24/2012 16:45,23,20,180,Cigar shaped almost aluminum in color hazy around it no sound
118,5/17/1956 10:22,23,6,20,This was a result of a prayer or telepathic request.  Seti is a load of crap.
119,5/7/2003 21:05,23,5,180,Unexplainable
120,6/30/2012 13:50,23,16,180,White disk shaped object above Ada OK.
121,8/7/2013 23:00,134,22,1200,While sitting out side these red/orange sphere apaired for a short time going up and then east.
122,1/2/2007 21:00,187,6,45,3 orange donut shaped objects
123,11/12/2007 04:30,167,6,3600,Unidentified Hovering Light seen in the Georgia Sky.  ((NUFORC Note:  Sighting of Venus.  PD))
124,9/14/2010 12:40,167,14,2,Extremely Low Flying Aircraft appears to be searching for something strange.
125,2/5/2001 23:10,82,11,900,3 craft triangular shaped with dome top with yellow light red  light on one wing blue light on other.  No engine noise.
126,6/1/1986 24:00,47,9,180,I just watched a show on tv on the history channel. There was an event where an Japanese airliner reported an ufo sighting south of the
127,10/26/2001 09:40,63,16,120,Silver disc the width of the jet stream of a jet appeared between two jets heading for each other.
128,11/13/2002 18:00,11,15,300,UFO&#39s Sighted in wis
129,1/5/2009 21:00,11,11,600,((HOAX??))  ufo broked my car
130,6/21/2008 03:00,11,11,10,Three lights in the southern sky outside bedroom window.  Flying very low.  No sound.
131,7/19/2001 22:25,11,9,30,Four large bright orange lights in straight horizontal line off of Hyw 13 three miles north to Adams
132,9/20/2005 07:00,116,16,600,It was fast made no sound and left no trail.
133,10/9/2010 20:30,191,6,120,Silent orange UFO spotted traveling in the sky then changing direction.
134,12/4/2012 19:10,191,4,120,3-5 Yellowish-orangish sphere/orbs seen by retired police officer in central Wisconsin
135,2/1/2005 05:30,169,19,1500,formation of 5 disk like moving very slowly  spread across horizon moving towards same location
136,2/1/2005 17:30,169,19,1500,5 shiney objects first resembled airplanes with short trails all 5 identicle in size shape tail altitude and distance apart.  Sprea
137,2/1/2005 17:40,169,19,900,5 identicle slow moving large disks took 20 minutes to drift across sky
138,2/7/2012 20:55,64,22,180,Hovering bright sphere with red lights over Adamsville AL
139,6/9/2008 20:36,64,22,120,Evening sighting one spherical object two witnesses.
140,7/24/2012 22:30,69,22,45,One round orange sphere 5-6&#39 around w/ bright circular glowing bottom center cruisin thru 20 mph 100 &#39 tops of trees
141,10/11/1999 22:30,17,16,600,Saucer shaped objectwith rows of red lights on bottom side; one white lighttop and bottom
142,11/14/1999 03:30,204,11,5,I saw a black Triangle containing 6 lights traveling due south for about 5 seconds before it disappeared
143,11/15/2006 19:00,204,10,300,Large shadow flew over head very fast
144,11/24/2011 21:33,17,1,480,Oval shape craft with 2 extremely large bright pulsating lights.
145,12/14/2010 23:00,17,9,900,Extremely bright light starlike
146,2/24/2013 18:20,17,22,30,Was outside having a smoke and just watching a plane over the south eastern skies when I glance to my left which if facing north.
147,4/23/2008 01:30,36,16,300,Large colorful disk shaped ufo over Addison.
148,7/13/2000 21:30,174,6,900,i thought it was a star till it started moving.
149,7/17/2002 17:00,204,14,60,Unidentified shape near airport
150,7/3/2010 20:30,204,4,180,Two bright orange circular-type objects appearing at edge of a city park during 4th of July festivities
151,8/14/2008 23:30,29,16,10,Faint orange disc high in the sky that faded away and disappeared.
152,7/9/2006 09:30,162,17,600,have seen from calif. the space shuttle reentering for landing. Theese objects looked exactly the same. comming from west to east obser
153,11/19/2013 18:20,3,11,420,Triangle rounded leading edges reddish /pink glow at tips of wing white left to right pulsing light at rear.
154,7/23/2012 23:55,7,3,60,Pulsating light in the northern sky that flew in a non aircraft way.
155,1/17/2008 18:30,72,11,1800,very strange and it looked very like a UFO.
156,11/8/2003 07:00,72,14,60,something drew my eyes to it as I do not always look in that particular direction when walking on my walkway
157,6/30/1984 06:40,72,22,600,Saw a flashing light that turned out to be something perfectly round floating above the ground
158,8/30/2011 21:00,72,9,60,Bright light moving fast but not a shooting star
159,10/14/2001 06:00,48,8,120,Erratically moving bright object with red and blue aura
160,5/28/2006 23:30,48,22,60,Bright blue sphere hovered then darted east and disappeared.
161,11/1/2006 20:00,117,11,180,The strangest thing that grabbed my attention was that as it flew overhead I could see up into it.  Like it had a glass bottom and I
162,12/10/2004 20:00,117,11,120,Silent black triangle moving very slowly about 75 feet off the ground.
163,1/2/2011 23:30,146,6,300,There was a green light and a round circle hanging over us.
164,2/12/1999 19:00,117,1,2,It was silver golwing and was rotating.
165,4/1/2011 22:35,49,11,5,3 round lights in triangle shape moved across sky at extreme rate of speed looked like a falling star at first but then as it came mor
166,4/26/2009 21:30,117,11,300,&#9;I saw four white lights three in a row one slightly lower and directly under the last moving in a northeast direction at a very slow
167,6/4/2004 23:00,117,6,3600,craft with blue and red aura around it  ((Twinkling star??))
168,7/6/2010 01:00,117,9,30,Triangular stationary sighting over Michigan July 6 2010
169,9/16/2003 07:00,117,1,1,Object making no sound and near almost no obstructions dissapears after observer breaks gaze for a few seconds.
170,1/30/2008 21:00,109,14,14400,Organized movement of mulitple lights/objects....in a circular pattern.  ((NUFORC Note:
171,3/24/2004 23:23,109,17,180,Strange UFO like sound coming from wooded &amp; farmland area.
172,6/5/2009 21:16,109,22,20,Greenish orb being chased by lighted military helicopter and blacked out helicopter.  Flying SW approx 150 ft off ground.  Orb was very
173,9/5/2013 00:00,109,8,420,UFO traveling north-south flys over rural farm area slowly and silently.
174,9/5/2013 12:00,109,11,420,Diamond craft looks like a very large bright red star then flys over us with blinking multicolored lights on stroke of midnight.
175,1/13/2014 03:10,180,9,1200,UFO Agawam MA 1/13/14 white blue orange lights slow moving silent impossible aviation moves 3:10 am.
176,11/8/2005 02:30,180,9,2,shooting star like till changed angle to giant question mark shape lasted 2sec never seen one change direction or last that long before
177,3/12/1999 18:30,180,11,300,I was outdoors and it was dark for about a hour when i noticed strang lights above the connecticut river. I hastely ran and got witness
178,6/1/1982 20:00,180,16,120,i saw it in agawam but chanell 22 reported it  in northhampton mass later that night   on the news.it had colored lights rotating.it ho
179,6/15/1982 20:00,180,22,120,ufo reported by channell 22in northhampton massachusettes
180,6/16/2001 23:15,180,10,90,Fast-moving silent UFO with strobe-like flickering lights spotted over Western Massachusetts 6/16/01 23:15
181,8/17/2004 02:30,180,11,600,Triangle shape
182,9/28/1998 20:00,180,1,120,I WAS AT MY AUNTS AND LOOKED UP IN THE SKY AND SAW THIS CRAFT HOVER THERE BOUT 2-300FEET UP IN AIRLIKE TWO PLATES ONE REVERSED WITH DI
183,10/26/2000 17:30,190,14,60,Reflective object see on ground by pilot.
184,10/5/2012 21:30,143,4,180,Intense bright white round light with purple blinking within it; darted up down sideways circling around &amp; repeated the motions.
185,11/1/2004 19:00,143,9,60,Two brilliant white lights hovered in the Southeast near Malibu Canyon and slowly faded at the same time
186,2/9/2005 16:30,143,22,30,Sphere traveling very high and very fast from south to north over the 101 freeway heading over towards Oak Park. Gracefully curved lef
187,3/14/2006 18:45,143,19,10,Three white dots flying across the sky in Agoura Hills CA
188,6/22/2008 03:00,143,9,600,Strong pulsating light that changed colors from red to green to white.  Object appeared stationery in sky
189,9/11/2007 17:30,143,16,300,Saucer shape w/lghts around rim that were in a chasing pattern. Red light on top in the center.
190,11/8/2012 23:57,141,17,60,Falling fire ball or stream
191,12/22/2005 19:10,78,15,3,This is the second time in two weeks.   Driving north on 14 Fwy looked to right and saw  an egg shape object fall from the sky.    The
192,9/13/2001 22:00,78,9,50,Object aproached along ridge ascendded and vanished.
193,7/16/2012 01:30,114,14,15,I saw a bright light where none should have been and watched it disappear.
194,8/6/1997 22:00,50,11,900,Large triange craft composed of 3 large white globes glided low over hiway in front of truck.  It searched the ground with beams of lig
195,3/15/2000 15:00,182,5,600,two metallic boxes connected by a cylinder witnessed near Aguilar Colorado
196,8/6/2002 21:30,202,9,240,Three lights in triangular formation
197,9/1/1976 23:00,202,4,120,Huge fireball hit and one big or three smaller  crafts with blue lights came from where it hit the ground
198,11/8/2005 22:00,151,4,1,white ball that fell into mountains
199,1/29/2014 07:30,151,9,1200,Flaming lights in the sky over Ahwatukee
200,11/23/2012 19:00,149,9,2,Light streaked forward in front of me.
201,12/6/2013 19:00,149,6,180,Orb On Oahu Hawaii Friday December 6th About 1900hrs seen going East and West Then Military Follow.
202,12/7/2004 16:20,149,6,120,Two seperate sightings On oahu
203,1/10/2003 19:30,107,17,1800,Unknown Slow Pulsing Light object moving accross I-20
204,11/15/1974 21:00,107,13,60,parallelogram shape outline only no matter (substance) visible between the inverting of itself changing from red to green
205,11/18/2004 11:30,107,6,120,Silver cylindrical object; no wings; no vapor trail; no sound .
206,11/18/2004 11:30,107,7,120,Straight-line flight with no visible wings or no vapor trail.
207,11/9/2007 01:30,107,20,900,Clearly visible metallic cigar shaped craft hovering above densely wooded area at night 75 yards away
208,12/27/2013 20:45,107,9,30,Very bright red light moving across the sky disappears. Another one of the same comes back 30 minutes later. disappears.
209,4/13/2010 08:30,107,11,30,Triangle shaped object moved slowly with no sound.
210,6/30/1967 21:30,107,1,180,Strange oval shaped silent metallic object about 2000 feet ovrehead with four oscillating lights
211,7/4/2013 21:00,107,6,60,Orb with orange glow
212,8/1/2008 00:00,107,22,10,Black circle in sky over a lake
213,12/14/2011 18:00,207,19,120,Six hunters see peculiar cluster of lights descend to the ground hover then streak off.  ((NUFORC Note:  Case resolved; flares.  PD))
214,12/15/1995 22:00,110,9,1800,Stationary light turns off then on then remains in sky for the entire next day but nobody notices?
215,12/18/2013 04:00,32,11,180,TRIANGLE OBJECTS HOVERING IN CORNFIELD.
216,3/10/2014 04:00,32,11,180,TRIANGLE CRAFT SEEN AGAIN IN AINSWORTH&#33
217,3/20/2004 00:15,110,9,3,Bright blue light covered sky on clear night while driving on highway.
218,3/5/2012 22:00,110,9,5,Bright white light about 5 times brighter/bigger than the brightest star at night north of Ainsworth.
219,5/11/2013 22:00,32,11,120,2 Triangle shaped crafts with red lights over Ainsworth Iowa.
220,8/18/2007 23:00,110,11,2,Strange lights over Ainsworth NE 2007
221,9/25/2008 03:30,110,11,30,Three objects that are silent and unexplainable
222,12/16/2010 19:40,99,9,600,3 lights zooming through the sky making loud buzzing sounds then vanishing.
223,3/17/2012 20:45,126,22,40,3 orbs in Airway Heights.
224,7/10/2003 20:00,126,22,2700,Orange sphere of light hovering several hundred feet above Fairchild Airforce Base.
225,7/14/2012 21:30,126,9,180,Two UFO&#39s in sky.
226,8/30/2001 19:30,126,6,600,Circular object with rotating lights moving south.
227,8/10/2002 22:45,188,19,10,Triangular light formation tree top height above my head in Aitkin Mn
228,9/5/2010 23:50,188,4,60,Glowing in the tree line was an amazing aluminous orange fireball .
229,11/30/2006 12:17,88,4,7200,Flying lights over Ajo and Southern Arizona.
230,11/30/2006 12:17,88,9,900,Flying lights Over Garlic Arizona.
231,11/30/2006 20:00,88,9,7200,Luces Voladoras Sobre Ajo Arizona Flying Light over Ajo Arizona
232,8/17/2002 03:00,88,17,9000,numerous red/blue stationary objects in the az desert sky.
233,9/16/2009 17:00,88,9,1800,Many lights changing color and blinking randomly merging and dividing flying randomly and also in formation in Ajo AZ on 9/16/09.
234,9/20/2005 19:45,88,16,180,I WAS SCANNING THE SKY WITH MY BINOCULARS WHEN I NOTICED AN ORANGE/YELLOW DISCK MOVING FROM NW TO SW IT WAS BRIGHTER THAN A SATTELITE
235,7/30/2004 11:00,158,11,1800,encountered 33 foot ufo in road close as 20 feet for over 30 minutes duration other evidence w/ photo
236,7/31/1999 00:30,158,11,1920,ENCOUNTERED UFO THAT APPROACHED WITHIN 50 FEET WAS 30 FEET WIDE AND REMAINED FOR OVER 30 MINUTES.
