sighting_id,datetime,location_id,shape_id,duration_seconds,comments
702,6/28/1964 21:00,56,16,600,1965 or 64  Chestnut Pl Alex VA  dusk saucer like with spinning top like red/blue/green bottom of object.
703,6/29/2012 02:15,208,11,30,6 red non blinking  triangle shape lights
704,6/6/2003 16:38,56,22,14,Object was circular in shape and dark as it appeared from my P.O.V. (about a couple miles away).  It dropped vertical and made a 90 *
705,6/9/2005 22:47,56,14,7440,siteing over alexandria va 22304 this is for real
706,7/25/2013 21:00,56,22,300,Bright white lights hovering over Potomac River near Washington DC and Alexandria VA.
707,7/26/2003 00:20,56,17,30,Was a light going from east to west it got brighter then dimmer did this twice then eventualy dissapeared into the horizon. Was just a
708,7/30/2004 20:15,56,9,1500,Very bright white point of light in northern sky at dusk.
709,7/4/2007 21:00,154,4,900,Ball of fire in Louisiana 7/4/07
710,7/9/2006 22:30,56,16,30,Cluster of disc-shaped objects that passed within 30 seconds
711,8/15/2012 23:00,56,4,60,11 yellowish/red/orange spheres slowly moving over Alexandria Va multiple witnesses.
712,8/19/2008 20:39,56,11,2,Saw a triangular formation of lights in the sky.
713,8/3/2011 12:31,56,16,1050,Epic sighting man....
714,9/11/2003 23:28,56,6,5,Brightzig zagging greenish-blue orb flashes across sky mysterious helicopter trails behind
715,9/11/2003 23:30,56,6,10,Not sure what it was but it went very fast across the sky not certain on the exact shape either as it was moving WAY to fast. It had a
716,8/17/2003 20:00,46,5,180,large rectangular craft in alfred me
717,8/8/2009 21:20,46,5,600,4 rectangular glowing objects glide silently by and ascend until they disappear into a point in Alfred Maine.
718,12/15/2003 08:45,206,14,15,BANK OF LIGHTS IN THE SKY.
719,1/23/2004 00:10,123,15,3,Large bright egg shaped flash
720,9/12/2010 12:32,164,14,300,Bronzed color  boomerang shape craft with an invisibility mode
721,6/3/2013 03:00,136,1,60,UFO sighting NM crashing behind treeline then dissapears- was illuminating blue from the bottom with 2 apparnet thrusters with no sound
722,4/28/2012 21:55,71,17,60,4 brightly lit crafts traveling at different speeds low elavation with no sound present.
723,10/1/2006 17:00,179,17,3600,6 people saw 2 objects in the sky that had lights and were flying in zig-zag patterns in the sky while staying in the same area.
724,3/17/2002 18:34,159,4,2,Bright green fireball streaks across Northwestern sky
725,7/25/2009 23:00,179,9,120,bright white light traveling north west to south east.  ((NUFORC Note:  Possibly the ISS but it was visible only at 21:30 hrs.  PD))
726,8/11/2012 21:30,159,9,720,Strange light formations in the night sky
727,5/23/2010 01:16,70,4,420,Fireball over canal changed directions and eventually split into 3 lights forming triangle.
728,6/30/1998 04:15,70,11,1200,there were three lights which made a triangle in the skys over Canada. the light would grow bright enuff to light up the sky and then d
729,7/15/2006 23:00,70,9,30,Algonac lights on 7-15-06 evening
730,8/29/1992 18:00,70,9,180,bright object bacame 8 separate objects and flew off in separate directions
731,9/2/1997 21:45,70,17,15,Starlike craft makes a pass three time faster than any sattelite horizon to horizon in less than 15 secondsAlgonac MI.
732,9/30/2010 20:00,70,22,600,&quot;V&quot; formation of orange spheres
733,3/15/2012 22:03,118,9,5,Fast lights in formation
734,6/1/1980 23:00,118,16,900,As a teenager I saw a flying saucer do triangular patterns then disappear. It had lights and was spinning
735,6/17/2008 14:15,118,10,10,((HOAX??))  It was a glowing yellow object that left a thin vapor trail that evaporated soon after it dissipeared.
736,7/31/2011 23:00,118,6,180,Glowing Orange Globe moving slowly across sky and then just disappeared followed 20 min later by another.
737,7/4/2009 21:46,118,9,90,Single fire colored object spotted moving in a slow and nonlinear way
738,8/6/2011 23:00,118,17,1800,3 Craft 1 went right  1 left the other straight  up and gone ?  No planes could do this
739,9/27/2001 21:00,118,4,10,Glowing ball seen descending into field.
740,9/3/2007 05:30,122,1,1200,Algood TN oval craft  over car no sound and burns us like a sunburn helicopter chasing
741,10/10/2003 12:00,196,1,300,3 Black ovals in the sky and a floating movie camera
742,10/2/1999 01:45,196,9,3,Luminous green object seen in slow descent before winking out.
743,10/4/2002 19:10,196,11,120,UFO Sighting near Los Angeles
744,11/17/2000 22:16,196,14,7,v-shaped  formation 25-30 craft very high very fast.
745,3/14/2011 12:00,196,4,60,It was round and highlighted green with an outer light green layer. Weasel it up close then disappear n within 2 seconds it appeard in
746,3/22/2013 03:00,196,9,3,Blue/green light appear in the sky.
747,3/25/2006 03:50,196,4,5,Bright flash of light and streak of light over Alhambra CA
748,5/13/2002 13:45,196,14,120,This craft was NOT unidentified.  It was in fact a P-2 Orion used primarily as an electronic intelligence gathering craft.What I fo
749,5/18/2009 12:45,196,3,5,bright light lit up Alhambra CA 12:45am  so bright that all street lights turn off
750,8/30/2003 23:00,196,9,120,I heard many stories but this time I witnessed it.
751,9/15/1977 13:44,196,16,1200,&quot;People of Earth; unite and love each other&quot;
752,10/24/2003 20:00,156,9,300,Tiny fast moving ball of light also an airplane flying nearby but had NO landing lights visible
753,10/3/2011 19:00,156,11,120,A triangle shaped object with three bright lights
754,11/3/2007 03:00,156,22,600,((HOAX??))  2 white shiny spheres.
755,12/9/2011 19:00,156,14,1200,Strange beam of smoke miles long in the  moonlight of south texas..........&#8230;
756,2/8/2006 20:03,156,9,1200,Two truck drivers witness two separate displays of peculiar yellow lights in the night sky.
757,3/15/1946 15:30,156,16,20,An extremely noisy disc.
758,8/5/2005 21:25,156,7,3,possible cruise missle sighting
759,2/24/2012 20:00,168,11,2,Triangular massive object with red lights
760,6/2/2012 23:00,168,9,15,Flashing lights moving at incredible speeds over Alliquippa
761,12/27/2006 21:15,67,6,120,round object hovering over city with upper and lower row of lights
762,1/29/2001 12:35,67,11,90,THESE OBJECTS APPERRED OVER ALISO VIEJO CA JUST 10 MIN. AGO. THEY WERE SILET AND LOOKED LIKE FLOATING HOUSES AND THEN THE 3 OF THEM SHO
763,1/4/2006 22:50,67,14,20,Aliso Viejo CA 1/6/06 10:50pm square shape in sky w/ dim lights in corners flying erratically  all directions above neighborhoods.
764,2/3/2011 19:12,67,9,1800,Bright moving cluster of lights above South Orange County
765,8/17/2012 21:34,67,4,30,Fireball approaching earth changing direction and disappearing into the clouds.
766,8/25/2009 21:45,67,9,35,A very bright white light moving slowly West from the South South East of Aliso Viejo California.
767,8/27/2005 21:45,67,7,240,A silver-white cylinder with detached bright yellow light right underneath seen hovering 1000 feet up and sped up noislessly.
768,8/27/2007 21:00,67,16,1200,Oval-shaped circle of very bright lights hovering and gliding from sided to side laterally in the sky over Aliso Viejo
769,10/20/2000 01:30,112,11,180,While driving we saw an unsual craft fly past us with unusually flashing lights.
770,11/24/2004 07:20,112,17,120,Bright light/enormous aircraft hovering over Allegan County
771,6/14/1986 19:00,112,14,300,pure white orb with tubular tail hovered over allegan dam
772,8/11/2000 04:30,112,19,3600,STRANGE STAR FORMATION LARGE BRIGHT  PULSATING LIGHTS.   THESE &quot;STARS&quot; KEPT BOUNCING AROUNDCHANGING PATTERNS.
773,3/23/2002 11:07,201,13,600,Object in the sky
774,3/3/2004 13:02,201,6,300,3 silver discs
775,7/15/1997 11:00,201,22,180,Ball of light
776,8/5/2009 23:30,201,16,1200,U.F.O. sighting over the Allegany river in New York.
777,10/13/2010 22:00,183,17,10,Shadow object...Black then (glow) speeding across night sky.
778,10/23/2008 19:00,183,14,2700,a boomerang in the sky what was  it?
779,10/26/2003 16:20,183,17,120,this afternoon while sitting outside on my patio I saw it again last week I saw it and now again&#33&#33 it is like the shape of a boomeran
780,11/13/2008 17:30,183,17,600,Entered atmosphere from the Far north as though falling 1000 plus knots.fell then leveled out over Allen TX tried to turn light em
781,12/17/2010 21:20,37,6,30,2 seperate occurances at the same time.
782,5/30/1999 22:35,184,13,18000,Saw 7 unidentified objects travelling from South-East to West over a period of 5 hours.
783,5/5/2010 06:00,183,9,720,Very Bright blinking light in sky brightest light I have ever seen.
784,6/10/1971 10:00,91,22,900,The ufo was above this radio tower. Me and my mom were watching it. It was about a half mile away as the crow flies.  The ufo started t
785,7/22/2011 03:00,183,11,120,Two triangle objects with blinking white and one red light. Flying at very low altitudes over suburbs silently.
786,7/28/2010 21:00,183,17,2700,large shape in the air with bright beam light around it. hovering in one spot would appear to move smooth but quickly side to side
787,8/6/2007 22:15,183,20,180,Suddenly a cigar shaped object bluish white in color sped across the sky underneath the planet Jupiter and rising as it sped across th
788,8/7/2008 21:20,183,10,60,Around 9:20 we saw a really bright light in the sky at first we thought it was an airplane but it didn&#39t have red blinking lights and i
789,9/10/2011 20:45,183,15,5,I was walking my dog down my block in this evening like I always do. As I came to the end of my block I looked up and saw green blue p
790,11/22/2012 16:30,147,4,600,Red Fireball in Southeastern Michigan sky 11/22/2012.
791,5/23/2001 01:30,147,11,30,On my way home Tue 22 may I was heading east on I-94turned south on southfield roadwhich is a two lane divided highway.Thats when I n
792,6/25/2006 07:00,147,14,60,it was huge just above the trees black with windows &amp; a bright light that lit up the sky
793,7/9/2012 22:15,147,22,30,I saw a round/spherical object move across the night sky at approximately 10-15000 ft altitude.
794,10/18/1984 22:00,34,9,1200,Appeared to be a bright star with multicolored lights surrounding it that moved in rapid 45 degree angle directions.
795,2/28/2008 22:00,6,11,1800,3 Triangle ufos over Allendale Ca  ((NUFORC Note:  Student report.  Possible hoax we wonder.  PD))
796,7/22/1959 14:30,197,9,300,07/22/1958    Allendale     Ky         Light in the sky  moving very fast             lasting 5 min.   posted 10/02/05
797,8/22/2009 23:15,34,9,600,U.F.O.&#39s in Allendale MI
798,9/10/2011 21:00,34,14,900,Multiable orange globes hovering
799,4/20/2013 03:20,128,9,1800,Bright light in Iowa sky
800,5/23/2007 22:30,90,1,5,oval  shape light
801,9/14/2007 21:40,90,9,25,SITTING IN CAR I LOOKED UP AND A STRANGE  ORANGE  LIGHT  CAUGHT MY EYE I FOLLOWED THE OBJECT  UNTIL  THE  OBJECT  STOPPED IN MID AIR
802,10/5/1980 21:00,98,9,5,Bright white light moves in U-pattern then fades out.
803,8/25/1985 22:30,98,9,60,An bright white light flashes 10 times.
804,10/17/2012 20:45,115,6,1500,We saw what looked like an orange fire ball just hovering for some time before moving southward followed by a fast moving aircraft
805,10/20/2011 07:30,115,5,1200,4 rectangular light blues shapes over Allentown Pennsylvania.
806,10/2/2010 20:00,115,9,10,Two bright white lights.
807,10/9/2006 04:15,44,22,7200,Multicolored fiberoptic looking sphere.  ((NUFORC Note:  Possible twinkling star.  PD))
808,11/19/2012 15:00,115,10,900,3 small objects very high in the sky flying very close together and performing different maneuvers.
809,1/1/1998 01:42,115,9,1800,One object too far to see size and shape one blinking light  red/green/white.  Stayed in oproximately same spot for about 30 minutes
810,11/21/2012 17:45,115,6,15,Bright orange light falling from sky rapidly.
811,1/14/2008 01:34,115,22,15,3 small Strobing craft flew over PP&amp;L building at great speed and headed over south mountain out of eye sight
812,1/15/2012 23:20,115,11,300,Three lights triangle shaped not flashing receding towards horizon very quickly.
813,11/6/1999 11:43,115,16,300,We were sitting in a car and looking up at a singal engine plane. Suddenly a small disc craft went flying past it. It was very close to
814,12/27/2013 17:40,115,22,1200,A formation of 4 reddish orange speares moving in formation one after the other.
815,1/7/2007 16:30,115,14,30,bright round white-ish object north of allentown PA
816,2/15/2009 23:00,115,6,1800,Bright light in nite sky
817,2/27/2004 22:40,115,6,180,Allentown PA at opprox. 10:40 p.m. estern. time I was standing in my backyard with my dog. I looked up at the big dipper to my north.Tr
818,3/6/2009 20:45,115,17,12,orange light making  two 90 right turns over s whitehall pa
819,4/19/2007 10:00,115,9,21600,Many brightly lit objects emitting multi-colored lights two military planes approached directly  and flew around several times.
820,4/27/2013 19:45,115,6,60,Headed home from work around 7:45pm driving north when I noticed a bunch of black circles high up in the sky. Stopped at a red light an
821,4/5/2012 17:45,115,5,120,Rectangular UFO Lehigh Valley
822,5/17/2006 21:00,115,11,120,The craziest thing that has ever happened in my life&#33&#33
823,5/27/2013 21:00,115,17,480,Two bright orange lights appeared from over a mountain South then hovered for about 2 minutes the disappeared East
824,6/1/1990 12:00,115,14,60,It was a clear day and warm.  I seen no lights on the object.  The size of it was astonishing.
825,6/14/1972 22:15,115,12,300,pink glowing boomerang[ufo]? seen moving across night sky.
826,6/15/1968 20:00,115,22,300,Craft and Crew sighted
827,6/30/2012 02:30,115,4,240,Red flying object  for about 4 minutes in our neighboorhod.  It did not made any noise and it was able to  fly horisontally and vertic
828,6/5/2007 22:00,115,17,1200,Extremely bright &#39twinkling&#39 star-like light hovering in cloudless night sky.  ((NUFORC Note:  Venus sighting??  PD))
829,7/25/1971 24:00,115,9,180,((HOAX??))  floatingglowing torus of light seen in neighboring yard.
830,7/31/2008 21:15,115,16,900,A pulsating light hovering over Allentown PA 2 miles west of LVIA
831,7/4/1978 23:59,115,16,60,SEEN  2  PALE GREEN  FLYING SAUCERS OVER ALLENTOWN  PA   ** JULY 4TH 1977/78 **
832,7/5/1976 02:46,115,17,120,MY FAMILY AND I HAD BEEN UP WATCHING BI-CENTENNIAL FESTIVITIES FROM COAST TO COAST ON NATIONAL TELEVISION; TALL SHIPS ETC.  BY 2AM MOS
833,7/6/2001 14:00,115,5,1200,rectangular object extended spiral tail (black and silver) and climbed to about 12k feet in under two minutes no noise or lights.
834,7/6/2012 22:40,115,17,60,Orange/ yellowish orb floating through sky
835,8/1/1960 12:00,115,7,3600,Historical color video of major USA event shows presence of UFO
836,8/14/2013 21:30,115,11,600,12 bright orange flashing objects coming east to west in staggered formation slowly disappearing in the sky in Upper Macungie Twsp.
837,8/28/2008 21:30,115,16,60,Slowly hovering disk shaped object with a four pronged star-like shape on the bottom flying 60 feet above tree level.
838,8/6/2013 23:00,115,4,600,Fire ball with flame
839,9/1/1983 20:00,115,16,2100,It was about 150 ft above me  made no sound emitted no wind floated till it came to Dorney Parkafter about 5 minutes it dropped and
840,9/18/2000 08:00,115,16,300,White disk shaped and very fast.
841,9/8/2006 19:50,115,9,5,Saw a low-flying line of green light in the sky for a few seconds that looked like a meteor or something.
842,11/14/2012 17:30,93,11,30,Triangle rainbow lights over Garden State Parkway.
843,12/15/1994 21:00,102,19,1800,Brightly Colored Orbs Over Portage County
844,3/10/2007 00:00,102,6,20,17 circles in four v shapes&#33
845,3/8/2013 21:02,102,19,480,Glowing triangular cluster flies over house with 3-4 chasing from behind
846,7/22/2009 21:00,45,9,1800,Saw 7 ufo&#39s in the night sky;  all within a 30 min.; most of which were going different dir.&#39s.  ((NUFORC Note:  Satellites?  PD))
847,8/16/2002 19:30,102,7,180,Missle shaped craft no wings no lights no landing gear no sound no CHEM TRAIL
848,3/23/2006 02:00,61,11,1200,I seen 3 triangle shaped air craft flying at 300 ft in perfect formation not a sound was heard.
849,11/7/2010 00:05,39,6,3600,Strange Objects Near Orion&#39s Belt
850,12/16/1997 19:55,39,21,240,A long hexagon shaped object crossed the sky just north of PittsburghPA with heading northeast and moving at a speed that I estimate
851,4/6/2007 23:15,39,9,180,Very small object seen above north park lake in pittsburgh
852,5/15/1988 08:00,39,22,120,glowing red shapeshifting ball sighted early morning
853,6/2/2003 01:30,39,22,45,UFO Seen In Allison Park PA along Rt.8
854,6/23/2012 20:00,39,17,3600,&quot;Solar&quot; glowing &quot;object&quot; during sunset.
855,7/11/1997 15:25,39,7,360,As I was driving near the site of a radio tower under construction I noticed a black barrel shaped object hovering near it. I stopped
856,2/8/2014 19:50,145,19,300,Facing Bellevue street to the Northeast (presumably by the WIXX building) I saw a Bright Red/orange Formation of lights in the shape of
857,4/27/2013 04:30,41,9,120,I woke up right after being sound asleep from a weird dream. Went downstairs in the house to get a snack right after i woke up. Walked
858,7/22/2010 02:00,41,14,21600,Unexplained lights and movement were spotted in the sky above my friends house.
859,11/22/1980 11:00,192,16,10,Saucer seen briefly over road - may have landed
860,4/9/2005 20:25,13,11,10,large triangular craft with 16 glowing round disks from below
861,5/10/1992 10:30,13,11,5400,Large Triangular object just outside Boston
862,5/15/1952 20:00,108,16,10800,Close encounter involving physical examination in unknown craft.
863,7/4/2012 22:50,108,4,180,Bright organe and red and disapeared with not a cloud in the sky
864,10/21/2000 09:30,125,1,15,white/silver oval high altitude high rate of speed
865,10/25/2000 21:05,76,9,10,Light goes into cloud and what comes out on the other end as three MEGA Size lights 2x the size of our 28 ft. trailer.
866,10/28/2001 03:00,66,22,3600,Floating illuminated nighttime sphere west of Alma Michigan
867,11/19/2011 06:05,125,9,900,Satellite like star in the morning sky moves in fast 45 degree angles at impossible speeds
868,1/19/2011 20:50,66,22,3,Sphere in the sky above Alma
869,3/3/2010 19:19,113,17,45,fast moving object wobbling at times at relative high speed moving east of alma
870,7/14/2005 23:00,113,9,25,A light going fast in a straight line &amp; jagged to the left once &amp; then dissappeared
871,8/14/2013 19:00,113,4,300,2 Fireballs trailing an aircraft . making erratic movements one which was vertical .
872,9/25/2009 21:30,113,17,4,Triangular pattern of lights hovering above Alma Arkansas
873,10/28/2011 06:00,205,9,10,Two Bright  Lights in three weeks sighted
874,1/23/2003 06:20,205,12,120,I was coming home from work.  It was very cold and the night or morning sky was clear.  For the past two mornings just before sunrise I
875,10/15/1976 23:00,199,17,14400,Electrical failure of my reliable vehicle and some missing time.
876,7/31/2008 21:20,85,11,30,V shaped winking lights.
877,10/20/1990 18:30,60,1,1800,UFO Almont Michigan Tree Top Lelel Humming Sound
878,11/7/1999 18:00,60,9,600,object the size brightness and position of Jupiter traveked N. for 10 min. before fading out.
879,2/12/2005 18:55,60,9,120,2 objects observed traveling across one quarter of the sky past the position of Saturn
880,5/17/1998 17:00,60,6,15,We saw a torroid shaped object moving due south at a high rate of speed.
881,10/21/2006 19:35,30,9,60,Bright light over Aloha OR travelling fast
882,11/3/2002 00:25,30,14,15,TWO SILENT ORANGE DIMOND SHAPE UFO&#39s STARTTLED MAN IN ALOHA OREGON
883,1/21/2004 18:23,30,6,180,This was no sattelite&#33
884,4/4/2003 18:35,30,22,2,Large sphere entering clouds at high rate of speed.
885,4/6/2014 22:18,30,1,480,Witnessed 3 glowing orange orbs fly in a straight line directly overhead in a steady direction one after another with about 30 seconds
886,5/13/2006 13:00,30,1,1,Oval Shaped Object  in the sky above residential neighborhood
887,5/20/2001 19:50,30,8,720,Slow moving orange dimond.
888,5/4/2013 21:00,30,19,180,Three Bright white lights in Triangular formation
889,6/25/2000 19:15,30,20,540,A tube like object slowly moving south at a steady speed until it disapeared.
890,6/4/2003 21:55,30,4,15,Fireball seen behind trees moving vertically then up into the sky
891,7/13/2011 11:00,30,6,120,UFO sighting after power outage
892,7/15/2000 22:00,30,9,15,This was a stationary large white light that  then moved slowly south then picked up speed quickly disapeared.
893,7/15/2002 07:45,30,6,300,Oregon UFO Review Case:  Three crafts seen overhead.
894,7/29/1998 00:15,30,9,3000,Looked like lights of a small plane approaching a local airport.  But the object stayed in almost the same place for over 50 minutes mo
895,8/13/2011 21:15,30,9,240,Three red lights over Aloha Oregon
896,9/26/2007 23:00,30,8,300,&#9;I was walking from my house the local shopping center and I looked up and saw what I at first thought was bright star or maybe an a
897,6/1/1983 23:00,172,22,300,Sphere with rows of windows Madison County Arkansas 1982 or 1983
898,7/4/2009 23:30,129,1,120,Orange craft manuvering very strangely of Alpena Michigan on July 4 2009.
899,2/27/2004 20:45,9,16,1200,I ran to the store and when I got back my 12 year old son and wife were very excited/nervous saying they had just seen a UFO and caugh
900,10/29/2003 17:45,38,22,30,Tarnished bronze sphere hovering in close proximity to a radio tower
901,10/7/2008 07:30,38,6,600,red circle up in the sky left trail.
902,12/1/2007 18:22,38,6,30,alpharetta georgia. bright white light. 25-30 seconds.  very far away looked like a star moving then became very bright and moved faste
903,12/24/2005 12:15,38,14,120,Incredibil fast lights.....
904,12/26/2013 18:00,38,6,1200,Four orange circular objects with triangle and lights at the top.
905,2/16/2007 20:00,38,12,20,A boomerang shape that disappeared in the night sky
906,3/10/1997 10:30,38,11,900,Boomerang UFO sits on barn
907,3/10/2014 07:20,38,1,30,Oval silent.
908,4/20/2009 01:30,38,5,300,Large detailed craft sighting brightly lit as if parked in the sky very close and lights/all white were pulsating.
909,4/23/2014 21:00,38,9,8,Green light n Southern Sky.
910,5/2/2010 20:00,38,9,60,I saw a glowing red object fly through the sky slowly headed in a SE then E direction.
911,5/6/2004 09:52,38,22,20,White Sphere flying below and at right ange to an airliner.
912,6/1/2007 23:00,38,11,1200,Triangle object with 3 lights followed by erratic light.
913,6/5/2012 21:35,38,22,180,About a dozen silent pulsating reddish-orange orbs in the sky
914,7/4/2010 23:08,38,20,120,Cigar shaped object shrouded  with amber flames/haze over North Atlanta on July 4th 2010.
915,8/14/2007 10:10,38,9,120,Three strange lights moving irregularly close together and at high speed.
916,8/25/2012 23:00,38,9,180,Slow moving steady bright orange light flew over and disappeared.
917,9/10/2004 18:30,38,1,60,Silver object skimmed across horizon just above tree lines on State Bridge Rd
918,9/20/2009 03:56,38,9,300,Orange lights smoke or fog.
919,10/12/1978 23:00,21,6,7200,DURING A HUNTING TRIP IN THE MOUNTAINSWE MADE CAMP AND LATE THAT NIGHT I SAW THE FOLLOWING. A BRIGHT LIGHT THAT CAME FROM THE SOUTHEAS
920,10/15/1969 23:30,21,16,300,Fall clear full visual disc sighting unbelievable air manuevers speed  brightness.
921,11/1/1974 20:00,77,9,2700,Mysterious lights in the sky around Alpine Texas
922,11/7/2001 10:00,77,14,120,Silent triangle
923,11/7/2011 10:30,77,11,300,5 Triangle shaped with red and bright white lights.
924,12/31/2010 21:00,80,3,600,While walking up Alpine Cemetery to go sledding a group of us saw a flashing light in the sky the light started to dim and then quic
925,1/3/2005 00:35,105,9,1200,cluster of 5 circular white lights
926,2/10/2012 20:00,77,9,300,Silent fast moving light no sound at all.
927,2/27/2008 21:00,77,11,45,triangular shaped object with green steady lights moving slowly with no sound and disappeared.
928,4/27/2001 23:00,105,11,5,Sighted a triangle object dark moving at a tremendous speed silently out of sight past the horizon in 5 seconds.
929,5/11/2011 12:05,55,22,1200,Hovering glowing spheres
930,5/3/2008 21:20,77,9,600,Three reputable witnesses see UFO over west Texas.
931,6/1/1961 00:00,80,16,2700,This sighting was in the early 1960s when I was 14 and had not heard of ufos yet but watched it with friends for about 45 minutes.
932,6/12/2008 03:18,80,19,120,we were laying on a trampoline gazing at the stars when we saw six bright lights moving in a cluster. They were moving at a moderate sp
933,6/14/1982 10:00,105,9,1500,The siting is parallels area 51 in Nevada the elevation abpove sea leval is significantly greater alt. than Area 51.
934,6/27/2013 23:55,105,14,30,Football shaped object w/no lights being chased by a helicopter.
935,6/3/2013 22:30,80,22,7200,Unidentified Flashing Object.  ((NUFORC Note:  Possible star we suspect.  160 degrees is not in the northern sky.  PD))
936,8/14/2011 16:50,105,14,300,Red and silver ball seen over mountain town of Alpine CA.
937,9/18/2011 20:15,80,6,180,Red circular object floating above Alpine Utah...STRANGE&#33
938,9/4/2012 20:30,80,3,5,Disc flares and disappears over Mt. Timpanogos UT 4 Sep 12
939,6/20/2012 19:00,139,9,60,Two bright balls of light ascending over forested area.
940,9/8/1999 20:00,139,9,240,Report(s) explained as NOSS satellite array
941,9/8/1999 21:00,139,19,300,3 satelite-like objects flying in tight formation over Oregon.
942,10/1/2005 01:10,138,9,480,RED LIGHTS SEEN IN ALSIP ILLINOIS
943,10/18/2012 16:30,138,5,180,Elongated rectangular object flying slower than an airplane but faster than a blimp.
