sighting_id,datetime,location_id,shape_id,duration_seconds,comments
472,11/3/2012 00:00,68,16,10,Green orb like ufo new mexico albuquerque 11/3/12
473,11/3/2012 00:00,68,22,15,Green Orb
474,11/4/1998 15:30,68,1,300,5 u.f.o objects seen in sky.One comes close to ground where i ride a bicycle .In daytime.
475,11/4/2012 12:00,68,17,10,I believe I saw a UFO today ...... small object moving slowly at first picked up speed and then accelerated to a very high speed.
476,11/4/2013 20:00,68,9,60,Falling lights.
477,11/5/2006 16:35,68,9,60,Bright light moving south and dimming out.
478,1/16/2009 18:30,68,14,30,Three spheres of light connected in a club like shape lower lights soft whitish upper light yellowish orangish traveling silently.
479,11/7/2012 14:00,68,9,1200,A star a planet?  Can&#39t possibly be.   ((NUFORC Note:  We suspect that the time may be flawed.  PD))
480,12/11/2010 21:00,68,1,120,Low in the ski with colored light then turned into big bright light moving towards me and then zipped across the ski.
481,12/1/1981 19:00,68,5,600,Rectangular checkmark shaped craft in NM near Albu. in Dec. 1981
482,12/1/2001 21:20,68,4,600,5 blue-white spheres w/bright glowing trails traveling slowly from south to north over Albuquerque 9:20 pm 12/01/01
483,12/15/1998 22:00,68,18,15,large cross shaped ship flew over the city .
484,12/18/2013 01:00,68,17,7200,My fianc&eacute; and I began to hear a resonating  loud humming noise.  The hum was omni directional.
485,12/21/2012 21:30,68,7,180,BRIGHT ORANGISH solid object; no noise increased and decreased speed. STOPPED ABOVE MY HOUSE for 1 minute and disappeared/vanishsed&#33
486,12/21/2012 21:30,68,7,300,Single orangish rectangle with rounded corners no blinking. Took a smooth route and was very fast and would decrease speed.; Vanished
487,12/2/2001 18:45,68,19,2700,Formation - White Triangle String of Lights and Large Red Glow
488,1/22/2004 12:45,68,14,900,In my car on Juan Tabo and Central Ave at 12:45 I noticed an object flying from an auto car dealership and a silver object that looked
489,12/2/2010 13:32,68,3,360,Flash over desert turing green and red in color flying supersonicly.
490,12/24/2013 21:15,68,13,60,Saw a kite-life UFO floating through the sky on Christmas Eve.
491,12/24/2013 21:30,68,2,1800,Christmas Eve 2013 headed South leaving Albuquerque saw a craft that looked like a spinning top with rings spinning around it
492,12/25/2013 21:45,68,2,3000,Bright cone with rings spinning around it hovering for 50 minutes.
493,12/31/2011 20:20,68,8,10,Cyan color diamond shape glowing object outskirts west of Albuquerque NM.
494,12/3/2007 15:35,68,17,10,saw a blue meteor falling in eorth east ski burnning out twenty seconds later saw bright lite in sky the light fadded out then dissapea
495,12/3/2007 17:35,68,6,600,Bright Round Shape directly above heads....
496,12/3/2007 17:35,68,17,15,Observed extremely high altidude single bright round light go from bright to dim and slowly float away. ((NUFORC Note:  Irisium??  PD))
497,12/4/2012 09:30,68,8,1800,Black diamond shaped ufo seen over hovering about 300-400 feet over city.
498,12/5/1970 20:00,68,14,120,1970 Sighting over Kirtland Airforce base in New Mexico.
499,12/5/2006 11:45,68,16,300,UFO Sampling Jets Contrail at 39000 feet
500,1/25/2008 22:45,68,9,10,high bright red light that disappeared
501,1/26/2014 18:30,68,15,1125,The craft was no any commercial or military aircraft I&#39ve ever seen.
502,12/8/1979 20:30,68,6,600,The night when I saw the disk UFO&#33
503,1/31/2013 19:45,68,9,180,Unexplainable steady light moves horizontally then disappears.
504,1/3/1994 23:30,68,11,240,Saw triangular craft approaching from horizon from the N.W. approached slowly silently and low to the ground.  Passed directly over
505,2/12/1999 17:10,68,22,600,object hovered due east.flickering brightness.disapeared.reappeared in different but close proximity C130&#39s landing .
506,2/19/2014 03:00,68,17,180,My mom who was up late last night and described an illumination very bright light from the sky which lit up her neighborhood.
507,2/20/2007 20:45,68,12,90,Watched a vee formation of 7 glowing gold chevron/B-1 bomber shaped objects fly silently overhead in night sky.
508,2/23/2014 21:05,68,9,30,I saw a bright orange oval shape that moved slightly and disappeared with no flash nor sound.
509,2/24/2006 13:12,68,16,20,Disk shaped object over Albuquerque NM hovered and sped away at high rate of speed.
510,2/26/2014 19:00,68,14,120,Twinkling string like light high up in the sky not surrounding by anything
511,2/5/1997 22:00,68,3,180,Two crafts flying onto field
512,2/6/2010 17:50,68,1,600,Oval ship flying over northwest albuquerque bright red yellow and white lights pulsing.
513,3/11/2012 23:00,68,7,12,Two dimmed lights traveling at insanely high speeds with no noise.
514,3/1/2007 21:35,68,22,60,Cobalt blue sphere being chased at hight speed SE to NW from ABQ New Mexico juxtaposition @ aprox. 9:30-9:35pm.
515,3/13/2004 20:08,68,12,25,ufo fly over  out of this world sighting
516,3/13/2008 20:45,68,9,120,Colorful light 1 mile N. I-40 &amp; Coors
517,3/13/2013 22:15,68,19,20,6-7 golden orbs in a V-formation like a flock of birds
518,3/16/1999 11:40,68,22,300,I saw a silver sphere shaped craft that was following in the contrail of a passenger or military aircraft.
519,3/18/2014 20:00,68,19,30,Still lights in a row with no movement for 30 or so seconds.
520,3/19/2000 09:05,68,1,60,white/silvery elliptical craft seen 45 degrees above horizon due west circling in the air rapidly before speeding off northwest.
521,3/2/2014 15:30,68,16,2,UFO follows jet.  ((NUFORC Note:  Witness is experienced amateur astronomer.  PD))
522,3/23/1997 16:30,68,14,8280,have photograph  21/4 negative 250mm Zeis len.some detail not much. object hovered over albuquerque shining in the afternoon light.
523,3/23/2008 12:55,68,3,180,Small flashing white light &amp; large fast white oval......
524,3/26/2008 20:00,68,9,120,a very birght and steady light at high altitude moving from south to north over Albuquerque NM at a high rate of speed.
525,3/29/2003 05:35,68,9,900,Small white light slowely gaining altatude over Albuquerque Morning sky&#33
526,3/29/2014 20:00,68,6,60,7 lights hover over the Base and Sandias.
527,3/3/2003 03:33,68,11,1980,scariest wierdest night of my life
528,3/5/2014 00:00,68,6,30,Bright light over Albuquerque.
529,3/5/2014 00:45,68,14,5,Bright quick flashes of light directly above my house in Albuquerque.
530,3/6/2007 20:00,68,6,900,UFO sighted on southern boulevard  on the west mesa in albuquerque.
531,3/6/2012 20:30,68,9,60,Did not see an object just long and fast bursts of extremely bright white light; some of which shot off at different angles.
532,3/6/2014 20:00,68,11,7200,I&#39ve seen crafts that make me think that we are big alone.
533,3/8/2013 19:45,68,17,60,Two glowing green ovals over interstate 40 just West of Albuquerque.
534,3/9/2014 20:45,68,22,60,White sphere descends from sky in the Bosque.
535,4/12/2014 21:00,68,4,4,A redish-orange sphere that appeared to glow or be on fire fell out of the sky towards the ground.
536,4/13/2013 22:00,68,9,3600,Above Albuquerque a very strange light has been flying in weird formations. It moves in small bursts like a fly on a window. It is a
537,4/15/1978 18:00,68,16,120,red glowing object in daytime sky
538,4/16/2000 10:25,68,5,300,saw first light then second light parked car to better observe and saw third light light seemed very high alt. light intensity fluct
539,4/16/2012 23:00,68,3,120,I was in my bedroom in bed.  I happened to look at my window and saw a deep blue horizontal light shaped like a bar flashing across the
540,4/17/2010 18:39,68,1,5,It was around the time I stated in the beginning of this report. 1730 hours I was sitting down on a chair smoking a cigarette. i looke
541,4/17/2012 22:00,68,3,2,Redsish star or Mars appeared to fade away
542,4/21/2006 21:40,68,11,12,Strange light in a triangular formation
543,4/21/2009 21:40,68,10,45,bright teardrop flys over the freeway in ALbuquerque
544,4/21/2013 21:00,68,9,120,Spotted an light much like a star but larger and green with subtle red light. Moved very erratically changing direction master than an
545,4/22/1999 22:50,68,4,4,A red &amp; green light streaked across the sky south of Osuna from East to West then dissappeared.
546,4/22/1999 23:40,68,11,30,I was looking out the east facing window of my bedroom when I noticed three dim amber colored lights that seemingly appeared out of now
547,4/22/2012 13:00,68,5,2700,White Circular object seen over Albuquerque NM
548,4/24/1994 00:01,68,22,3,I was on my way down from the Sandia Mountain peak ( on a tramway) when I saw a bright orange flash and an ornange ball of light speed
549,4/24/2014 21:00,68,9,30,Orange-red light followed by a blinking green and red light; large rumbling noise unlike a plane could be heard.
550,4/25/1994 02:00,68,22,3,Glowing sphere makes figure eight around two people.
551,4/25/2007 13:00,68,5,150,White rectangle seen falling and then speeding off apparently under power of two &quot;cones&quot; of orange lights that suddenly came out
552,4/25/2013 09:28,68,5,3,I was facing to the Eastern sky at angle of 35 degrees rise from horizon.  The little dipper is to my left.  I am watching a jet high i
553,4/26/2001 03:00,68,9,180,Upon driving from Albuquerque to El Paso TX I came upon two red lights that were going across the sky following a star pattern. They m
554,4/28/2013 03:00,68,9,60,Diamond formation of lights over Albuquerque.
555,4/28/2013 21:00,68,9,300,12 sperate ghostly lights that flew in changing formations with no sound.
556,4/28/2013 21:30,68,9,60,This was identical to the craft I saw one week earlier spotted in the exact same area of sky on the south end of Albuquerque.
557,4/4/2012 17:38,68,16,360,One craft at altitude that remained stationary for length on observation.  It appeared to be lower than commercial air traffic because
558,4/5/2003 22:30,68,12,900,Extemely large &quot;flying wing&quot; hovering above a shopping center in Albuquerque NM then left southbound at slow speeds.
559,4/6/2013 10:35,68,6,120,Object appeared in photo after seeing military aircraft
560,5/1/2009 19:30,68,9,180,Bright light heading for Earth near Albuquerque NM
561,5/15/1979 02:00,68,6,60,Near encounter (100 feet) for 1 minute.
562,5/25/2002 00:00,68,6,2700,CRAFT AND IT&#39S PROBE MOTIONLESS OVER NUCLEAR DEPOT ONE HOUR AT AFB IN ALBN.M.
563,5/25/2010 22:00,68,3,600,a bright light over Albuquerque NM
564,5/26/2001 02:00,68,16,7200,First look I knew it wasn&#39t something human made.
565,5/27/2004 23:00,68,9,900,6 white lights over Albuquerque
566,5/28/2007 07:30,68,22,7200,white round object motionless over albuwuerque
567,5/28/2009 21:30,68,9,60,Los Ranchos Bright Light
568,5/28/2009 21:30,68,9,60,Still for 5 seconds and very bright
569,5/30/2007 22:00,68,16,2700,Multi colored object(s) and one object emitting white light only in the Far West Mesa area
570,5/31/2010 20:00,68,14,1800,lights shooting across NM sky.
571,5/4/2011 09:00,68,14,2102400,((HOAX??))  Get the metal out of my body
572,5/8/2011 19:00,68,11,2100,Reddish orange glowing triangular object appearing to viewers 30-35 minutes toward the West.
573,5/9/2008 00:00,68,17,15,Im not too sure on the time a hour or two after nightfall. So maby 10=11pm. I was in back yard smoking and looking into the south west
574,6/10/2013 22:30,68,19,300,Disk and a small cluster of strange lights.
575,6/1/1988 21:30,68,22,180,Silent sphere with multicolored lights floats slowly over Albuquerque then shoots north then west out of sight.
576,6/1/2000 15:00,68,9,2400,On a clear cloudless summer afternoon in the summer of 2000 I was hiking alone in the Sandia Mountains just east of Albuquerque NM.
577,6/1/2005 15:00,68,6,2,1 circular partially clear object sat in sky for about 1/2 hour and did not move. It changed opacity several times stayed in same posi
578,6/12/2003 21:00,68,17,1,Bright green dot made a half circle maneuver in the New Mexico sky and i heard to sound
579,6/15/1995 19:30,68,16,30,Three disk shaped objects appeared to the north. Objects were blue in color nearly the color of the background sky. They were about ha
580,6/19/2005 12:50,68,17,300,A brightly flashing object was seen in broad daylight.  It rose suddenly hovered then dived and sped away.
581,6/20/1965 02:00,68,16,300,Traveling in a pick up truck we saw a bright glowing green disk fly over us.  It made the engine &amp; electrical of the truck stop immedi
582,6/20/1989 22:45,68,19,600,14 lighted objects on a clear night in New Mexico.
583,6/22/2012 00:30,68,9,180,6/22/12 albuquerque new mexico  silver lite 3min  6/23/12
584,6/27/2012 21:00,68,14,60,White flashing fading light in the sky
585,6/28/2000 02:00,68,9,600,the star in the night sky stated dancing only to return back hidden.
586,6/28/2003 04:00,68,6,60,Photos of UFO in sky above Sandia Peak NM
587,6/3/2000 14:30,68,22,3600,Saw a large bright spherical object being stationery in windy skies over the Albuquerque International Airport.
588,6/3/2004 15:40,68,22,120,The object appeared to be a metallic looking sphere that flew in an erratic manner.
589,6/8/2008 19:30,68,14,600,Bright stationary circular object in high atmosphere in broad daylight gives way to five smaller moving crescents
590,7/15/1977 21:00,68,12,600,The object appeared to be a giant piece of glass.
591,7/15/1986 19:30,68,12,300,My friend and I were relaxing in a park during the summer of 1986 not far from a friends house where we had left about a half hour earl
592,7/15/1998 01:30,68,4,120,Green Fireball Sighted Near Albuquerque Moving Directly Up From the Ground
593,7/18/2003 22:00,68,11,20,TRIANGLE SHAPED PHOSFLORESANTLY LIGHTED STRINGRAY SHAPED CRAFT
594,7/18/2008 03:15,68,9,900,When first sighting the light it was moving unusually fast and changed course after a few minutes and then conducted erratic movements.
595,7/19/2006 19:20,68,20,30,white cigar shaped silent and seemed to glow
596,7/19/2008 18:24,68,16,300,Black round disk over Albuquerque
597,7/20/2006 24:00,68,16,276,Hoovering Probe&#33..
598,7/24/1977 07:00,68,1,3600,A gaint greyish football moving through the sky
599,7/24/2009 21:30,68,13,900,Albuquerque New Mexico USA Object/Lights Night Sky July 24 2009 21:31-21:51 PM
600,7/31/2004 19:35,68,6,180,Bright white sphere traveled across Albuquerque sky
601,7/31/2010 04:15,68,20,20,Night sky turned white with a cigar shaped object in the middle of a circle of light
602,7/4/2008 22:30,68,22,4,Sphere seen at Fourth of July Fireworks Albuquerque
603,7/4/2010 21:00,68,22,300,A bright yellow light over Albuquerque on July 4th  1/2 hour before the city fireworks display
604,7/7/2012 22:00,68,17,3600,Lights swirling around in clouds above Albuquerque
605,8/10/1998 06:00,68,4,1200,Object seen streaking across sky leaveing huge contrail it was across the horizon over head and heading east to west along hwy40(ro
606,8/10/2003 19:00,68,17,6000,Stationary object over New Mexico
607,8/11/2002 04:20,68,6,120,SIX  DIFFERENT  CIRCLULAR  OBJECTS  MANOUVER  OVER  HOME  AND  DRIFT  FROM  VIEW.
608,8/1/1998 23:00,68,11,600,Triangular UFO over South Valley High School
609,8/15/1967 14:00,68,20,1800,three terrified kids
610,8/15/1999 23:18,68,17,2,An extremely bright flash of light lit up the sky and groud and appeared to travel from SW to NE.
611,8/19/1998 00:00,68,9,180,light in the sky heading west that changed color and like a rubberband it zipped back heading east into space disapearing in the stars
612,8/19/2009 22:00,68,20,10800,Short cigar shaped object with rays of light eminating from one end; stayed in the sky for 2 hrs+.
613,8/2/2011 21:15,68,6,60,Green glowing circle being chased through the albuquerque sky by helicopter
614,8/23/2002 03:45,68,3,5,I was smoking a cigarette when I looked up and saw a little brite light  moving slow for about 5 seconds. Then i saw it flash with a br
615,8/24/1998 13:00,68,11,10,My family and I were driving through the United States and my father took a back road...and we stopped the car to take pictures of the
616,8/27/2002 21:00,68,9,30,High velocity redish-orange light makes 90 degree turn without deceleration.
617,8/30/2003 23:55,68,9,30,Saw two steady red lights moving very fast very silently jerking around East to West over Albuquerque NM.
618,8/30/2004 21:45,68,17,180,The object&#39s lights were different and its rapid gyrations were most violent to be a normal aircraft.
619,8/31/2004 16:10,68,6,60,White circular object rising straight up faster than balloon.
620,8/31/2013 04:30,68,9,5400,THE SKY SOUTHEAST OF ABQ THERE WAS A GROUPING OF LIGHTS JUMPING IN ONE AREA FOR OVER AN HOUR
621,8/3/2004 14:00,68,22,30,Silver sphere seen over mountain in New Mexico
622,8/4/2009 20:57,68,14,120,Blue/Green Glowing Figure 8 shape sighted in North East Albuquerque - followed by possible Military Aircraft
623,8/6/2013 23:30,68,17,180,Red and green lights of different sizes pulsating then &amp;quot;turning&amp;quot; upside down and moving direction rapidly on I40 at Wyoming e
624,8/7/2009 22:20,68,5,900,Black Rectangle Three Green Light Bars UFO Crash seen from Albuquerque 08/07/2009
625,8/9/2000 12:48,68,6,20,i was taking pictures of the sunset and didn&#39t notice until later what had passed in front of my lense.
626,9/11/2001 11:30,68,22,600,Spherical silver balls which emitted bright white light
627,9/11/2005 05:25,68,6,10,A dim orange sphere traveling in a sweeping curve.
628,9/16/2004 19:30,68,9,1800,Possible Weather Balloon?
629,9/19/2003 19:00,68,9,300,Bright red light in Albuquerques southwestern sky.
630,9/19/2003 19:00,68,22,3600,Bright star like light visible in daylight faded to faint star at night.
631,9/19/2013 19:45,68,6,900,Star like craft with wings just hovering in one spot in the sky airplanes flying near it and dogs are barking like crazy.
632,9/20/2005 19:28,68,9,600,Brilliant white light west of Albuquerque
633,9/20/2013 23:00,68,17,3,Something fell to earth in new mexico last night craft like.
634,9/21/2001 20:10,68,1,7,A couple of friends my wife and I were staying in Albuquerque (87104) at the Sheraton Old Town hotel on September 21 2001.  We were s
635,9/21/2007 12:20,68,20,60,Bright White disk shape hovering then suddeny dissapears. Very shocking.
636,9/21/2013 19:00,68,7,900,Large bright cylindical UFO observed for 15 min.   ((NUFORC Note:  Helium-filled balloon at high altitude.  PD))
637,9/22/1967 22:30,68,17,3600,A property search and a  &quot;close encounter&quot; with unknowns?
638,9/22/2012 17:30,68,6,3600,Circle shape to the west  staying mostly in one spot as light fades it gets harder to see.  Smaller than the moon but way bigger than a
639,9/22/2013 06:00,68,22,450,A brilliant white nonmoving light or orb seen in Eastern sky over Albuquerque for about 2 or more hours.
640,9/25/2000 19:30,68,9,1800,At twilight we saw through binoculars three bright lights arranged in an inverted triangle making small darting movements in place.
641,9/29/2013 20:45,68,9,300,Extremely fast and agile green light over Albuquerque.
642,9/30/2006 19:00,68,17,2,3 UFOs seen in one weekend
643,9/4/2012 21:30,68,14,1200,At 930pm mst myself and two other once again saw a light appear 35% above western horizon due west of our house. object had green and r
644,9/5/1995 18:00,68,11,20,It moved fast and stopped over my head. Then it hovered for 10 sec. before it speed off like it had turned. But the object never turne
645,3/19/2012 08:30,120,9,15,It was neat. Wonder what it was?
646,4/3/2004 11:45,171,16,3300,Daylight disk near Alcalde NM
647,10/23/2013 21:15,195,9,7,A mysterious shooting star heads straight for our car but dissapears before it hits us.
648,5/3/1995 22:30,16,9,1200,I was just about to goto bed and I looked out my window for some strange reason and I looked to the south and I saw this very bright li
649,9/23/2013 02:00,20,17,420,Auditory phenomena of unknown origin repeated at same time at two week interval.
650,12/1/2001 22:18,43,19,60,Three craft with red and white &quot;tails&quot; slower and larger than shooting strars were seen moving fron SW to Northeast.
651,2/26/2004 17:00,43,16,600,1 DISC shaped object - did not seem to be controlled
652,3/17/2007 21:55,43,4,2,fiery comet-like meteoroid
653,4/28/2011 12:00,160,22,60,Four white metalic spheres with red glass-ish window on the front heading East over Aledo Il.
654,1/9/2009 18:33,79,3,900,A Flashing strobe light occured before complete dawn. It grew brighter in size brightness and then would suddenly decrease in size and
655,10/18/2003 15:00,96,6,120,Please take this serious.
656,10/22/2010 19:30,56,9,300,Most unusual fireworks display
657,10/22/2012 20:07,56,9,240,Eventually the truth will reveal itself
658,10/23/1998 21:45,154,4,60,greenish white fireball ascending across clear night sky fromeast to west following an irregular flight path and chg&#39s in speed.when ob
659,10/23/2013 22:10,56,9,45,Three (3) orbs of light rapidly moving through the night sky maneuvering around each other before racing off at an incredible speed.
660,10/5/2011 19:40,56,14,5,Sitting out on deck. Sky pretty dark for urban area. Looking with 12x60 binoculars in the &quot;summer triangle&quot; for asterism called the &quot;co
661,11/15/2013 19:00,154,4,300,Red orange in color fireballs appearing to be drifting from east to west across the Southern sky.  About 10-15 of them.  Visible for a
662,11/28/2012 17:00,56,1,240,2 red/orange oval shapes hovering in air
663,1/14/2002 19:15,154,19,60,Row of lights over city
664,11/5/2003 19:00,56,17,2,6-8  Bright lights in a line. Moving slowly north. Over or near Old Town Alexandria/Potomac River.
665,11/5/2007 23:00,56,11,20,A large black triangle passed over our house and into the west at night.
666,11/7/2001 17:30,56,4,5,Ball of light moves over heads of people in traffic - appears to head toward the ground but no sign of crash evident.
667,1/20/2002 20:18,56,9,1,colorful bright  fast light of line
668,12/11/2000 06:24,189,8,30,My father and I were leaving on our way to take me to shool. When my father stopped pulled to the side of the road and pointed to a fo
669,12/11/2008 18:40,154,6,240,trail of golden lights in a straight line lasted for 3-4 minutes in the louisiana sky
670,12/12/2003 17:50,96,10,120,Look at that what is it dad  my god what are they?
671,12/13/2003 02:20,56,4,5,Outside smoking a cigarette when I look up into the sky and see a green ball go across the sky very fast like a meteor thought it to b
672,12/14/2012 23:29,56,9,60,Orange Flickering Light Moving and Motionless near Washington D.C.
673,12/15/2005 19:30,154,20,900,AFTER WE GOT BACK FROM DINNER TO THE HOTEL WE SAW A CIGAR UFO WE WERE IN FRONT OF THE HOTEL.
674,12/18/2013 16:20,56,4,600,Drones?
675,12/29/2003 22:30,56,4,1,Green Fireball decends around Fort Belvoir Virginia
676,12/30/2003 16:45,56,9,900,3 objects with a trail of smoke attached hovered together in the sky over the expressway
677,12/30/2003 16:45,56,9,900,While on I-495 S. towards Richmond VA heading home from work I sat in very slow traffic and observed what I thought was airplane smo
678,12/4/2009 05:00,189,11,3,huge triangle shaped aircraft flying low that flew fast but made NO NOISE at all.
679,12/4/2011 19:30,56,9,120,Husband drew my attention to object outside our window.  Object was bright (looked almost like it was on fire fluttering light)   Obje
680,12/7/2004 19:55,154,19,15,While driving a friend ogf mine and I both saw random glowing lights appear in the sky then formed a strait line and dissapear
681,1/28/2009 13:45,56,14,1200,a video tape of a ufo but when played back nothing.
682,1/31/2014 20:54,56,9,2,Galling white light in Alexandria VA.
683,2/13/1979 01:00,56,9,120,white light over Alexandria at night grew in intensity-took three pictures
684,3/10/1998 20:00,56,12,4,March 97 0r 98   4-5 seconds    Alexandria VA  Chevron shaped  and huge glide overhead then suddenly  go out of sight...
685,3/18/2012 21:45,56,11,30,Triangular UFO moving swiftly and silently next to Washington DC
686,3/19/2006 23:53,56,4,2,Neon Green Flash Fireball
687,3/22/2013 19:53,56,17,3,Object turning from bluish-white to yellow-orange seen crossing nighttime sky in Fairfax County VA.
688,3/25/1998 23:30,154,11,120,Five white  lights in V-shaped pattern seen along Interstate 49 just south of Alexandria
689,3/25/2007 10:45,56,6,45,Two tranclucent cirlces float over D.C.
690,3/7/2003 05:00,56,9,1200,About 5:00 AM saw two bright flashing lights moving a high rate of speed.  Not the usual aircraft lights.  They in one direction and th
691,3/8/2004 23:00,56,5,20,A huge craft that appeared to be attempting to cloak itself soundlessly flew from the west to the east and blended into the night sky.
692,3/9/2004 19:57,56,6,60,Moving bright light March 9 2004 7:57 PM Alexandria Va.
693,4/18/2006 14:30,56,22,120,I was on a bus leaving Landmark Mall Shopping Center.  It was a bright sunny day with some high cumulus clouds.  As the mall sits on t
694,4/20/1963 17:00,56,9,900,4 red lights flying near Mt. Vernon Va. toward Potomac River in early evening April 1963 or 1964
695,4/4/2004 03:38,56,9,20,((NUFORC Note:  Possible hoax.  PD))  Light there going across sky one second then gone ..
696,5/1/1975 02:40,56,4,2,Pretty sure this was nothing other than a Meteor but it hit probaly a few miles from my house or thats the way it looked at least ..was
697,5/12/2011 01:37,56,4,12,My daughter and I were driving southbound on Route 1 richmond highway pass the intersection of lockheed blvd and route 1 from the left
698,5/13/2006 21:28,154,9,900,Fighter jets chased 3 lights above my house.
699,5/26/2008 04:30,56,9,600,Red and white lights sighted in Alexandria VA.
700,6/11/2009 21:30,154,3,3120,Recurrent orange and white lights over Alexandria LA
701,6/1/1976 21:00,154,9,180,Ball of light incapacitated my best friend and scared me
